,usageclass,checkouttype,materialtype,checkoutyear,checkoutmonth,checkouts,title,isbn,creator,subjects,publisher,publicationyear
3580,Digital,OverDrive,AUDIOBOOK,2018,1,1,Sweet Salt Air: A Novel (unabridged) (Unabridged),,Barbara Delinsky,"Fiction, Literature, Romance",Macmillan Audio,2013
3588,Digital,OverDrive,AUDIOBOOK,2018,1,2,Roller Coaster (Unabridged),,Marla Frazee,"Juvenile Fiction, Juvenile Literature",Live Oak Media,2013
3603,Digital,OverDrive,EBOOK,2018,1,2,The Secret Life of Lady Lucinda,,Sophie Barnes,"Fiction, Historical Fiction, Romance",HarperCollins Publishers Inc.,2013
3609,Digital,OverDrive,EBOOK,2018,1,1,Shrapnel: A Memoir,,William Wharton,"Biography & Autobiography, History, Military, Nonfiction",HarperCollins Publishers Inc.,2013
3673,Digital,OverDrive,EBOOK,2018,1,1,"The Demon and the Succubus: Sisters of Darkness Series, Book 2",,Cassie Ryan,"Fantasy, Fiction, Romance","Penguin Group (USA), Inc.",2013
3699,Digital,OverDrive,EBOOK,2018,1,12,"Ender's Game: Ender Wiggin Series, Book 1",,Orson Scott Card,"Fiction, Science Fiction",Macmillan Publishers,2013
3714,Digital,OverDrive,EBOOK,2018,1,4,Reservation Blues: A Novel,,Sherman Alexie,"Fiction, Literature",Open Road Integrated Media,2013
3772,Digital,OverDrive,AUDIOBOOK,2018,1,2,Wonderfully Made (Unabridged),,Joyce Meyer,"Juvenile Fiction, Picture Book Fiction",Zondervan,2013
3821,Digital,OverDrive,EBOOK,2018,1,1,Rosinante to the Road Again,,John Dos Passos,"Nonfiction, Travel","Sterling Publishing Co., Inc.",2013
3864,Digital,OverDrive,EBOOK,2018,1,9,Purple Hibiscus: A Novel,,Chimamanda Ngozi Adichie,"Young Adult Fiction, Young Adult Literature",Workman Publishing,2013
3925,Digital,OverDrive,EBOOK,2018,1,1,"Tracking Bear: Ella Clah Series, Book 8",,Aimée Thurlo,"Fiction, Mystery",Macmillan Publishers,2013
3930,Digital,OverDrive,EBOOK,2018,1,2,The Stanislavski System: The Professional Training of an Actor; Second Revised Edition,,Sonia Moore,"Nonfiction, Performing Arts","Penguin Group (USA), Inc.",2013
3968,Digital,OverDrive,EBOOK,2018,1,1,Going Once,,Sharon  Sala,"Fiction, Romance, Suspense, Suspense","Harlequin Enterprises, Ltd.",2013
3981,Digital,OverDrive,EBOOK,2018,1,6,Wired for Love: How Understanding Your Partner's Brain and Attachment Style Can Help You Defuse Conflict and Build a Secure Relationship,,Stan Tatkin,"Family & Relationships, Nonfiction",New Harbinger Publications,2013
4006,Digital,OverDrive,AUDIOBOOK,2018,1,1,"Poppet: Jack Caffery Series, Book 6 (unabridged) (Unabridged)",,Mo Hayder,"Fiction, Mystery, Suspense, Thriller","Dreamscape Media, LLC",2013
4050,Digital,OverDrive,AUDIOBOOK,2018,1,1,The Empty Land (Unabridged),,Louis L'Amour,"Fiction, Western",Books on Tape,2013
4059,Digital,OverDrive,EBOOK,2018,1,1,"Murder on Lexington Avenue: Gaslight Mystery Series, Book 12",,Victoria Thompson,"Fiction, Mystery","Penguin Group (USA), Inc.",2013
4091,Digital,OverDrive,AUDIOBOOK,2018,1,5,"Children of Dune: Dune Series, Book 3 (unabridged) (Unabridged)",,Frank Herbert,"Fiction, Science Fiction",Macmillan Audio,2013
4099,Digital,OverDrive,EBOOK,2018,1,1,Southern Storm,,Terri Blackstock,"Fiction, Mystery, Suspense, Thriller",Zondervan,2013
4106,Digital,OverDrive,AUDIOBOOK,2018,1,2,The Sum of All Kisses (Unabridged),,Julia Quinn,"Fiction, Historical Fiction, Romance",HarperCollins Publishers Inc.,2013
4143,Digital,OverDrive,EBOOK,2018,1,5,"Books Can Be Deceiving: Library Lover's Mystery Series, Book 1",,Jenn McKinlay,"Fiction, Mystery","Penguin Group (USA), Inc.",2013
4150,Digital,OverDrive,AUDIOBOOK,2018,1,2,Secretly Smitten (Unabridged),,Colleen Coble,"Christian Fiction, Fiction, Romance","Oasis Audio, LLC",2013
4167,Digital,OverDrive,EBOOK,2018,1,1,Paprika: A Novel,,Yasutaka Tsutsui,"Fiction, Literature, Science Fiction","Random House, Inc.",2013
4169,Digital,OverDrive,EBOOK,2018,1,1,A Peace to End All Peace: The Fall of the Ottoman Empire and the Creation of,,David Fromkin,"History, Nonfiction",Macmillan Publishers,2013
4215,Digital,OverDrive,AUDIOBOOK,2018,1,1,The Beggar King and the Secret of Happiness: A True Story (unabridged) (Unabridged),,Joel ben Izzy,"Biography & Autobiography, Nonfiction, Self-Improvement",HighBridge Company,2013
4218,Digital,OverDrive,EBOOK,2018,1,2,"Cockatiels at Seven: Meg Langslow Mystery Series, Book 9",,Donna Andrews,"Fiction, Humor (Fiction), Mystery",Macmillan Publishers,2013
4224,Digital,OverDrive,AUDIOBOOK,2018,1,2,"The Winter Queen: Erast Fandorin Series, Book 1 (unabridged) (Unabridged)",,Boris Akunin,"Fiction, Historical Fiction, Mystery, Suspense",Books on Tape,2013
4234,Digital,OverDrive,EBOOK,2018,1,2,Tierra de todos: Nuestro momento para crear una nacion de iguales,,Jorge Ramos,"Nonfiction, Politics, Sociology","Random House, Inc.",2013
4243,Digital,OverDrive,AUDIOBOOK,2018,1,5,"Takedown Twenty: Stephanie Plum Series, Book 20 (unabridged) (Unabridged)",,Janet Evanovich,"Fiction, Humor (Fiction), Mystery",Books on Tape,2013
4248,Digital,OverDrive,EBOOK,2018,1,1,"The Good Thief's Guide to Amsterdam: Charlie Howard Series, Book 1",,Chris Ewan,"Fiction, Mystery, Thriller",Macmillan Publishers,2013
4301,Digital,OverDrive,EBOOK,2018,1,2,"Unlawful Contact: I-Team Series, Book 3",,Pamela Clare,"Fiction, Romance","Penguin Group (USA), Inc.",2013
4308,Digital,OverDrive,AUDIOBOOK,2018,1,2,Protection Workshop (Unabridged),,Cassandra Eason,"Nonfiction, Religion & Spirituality, Self Help, Self-Improvement","Blackstone Audio, Inc.",2013
4323,Digital,OverDrive,EBOOK,2018,1,2,Strapless,,Deborah Davis,"Art, Nonfiction","Penguin Group (USA), Inc.",2013
4366,Digital,OverDrive,AUDIOBOOK,2018,1,1,Why People Don't Heal: And How They Can (unabridged) (Unabridged),,Caroline Myss,"Health & Fitness, Nonfiction","Sounds True, Inc",2013
4400,Digital,OverDrive,EBOOK,2018,1,4,Low Pressure,,Sandra Brown,"Fiction, Suspense, Thriller","Hachette Digital, Inc.",2013
4471,Digital,OverDrive,EBOOK,2018,1,1,Until the End of Time: A Novel,,Danielle Steel,"Fiction, Literature, Romance","Random House, Inc.",2013
4499,Digital,OverDrive,EBOOK,2018,1,2,Kiss of Surrender,,Sandra Hill,"Fantasy, Fiction, Romance",HarperCollins Publishers Inc.,2013
4519,Digital,OverDrive,EBOOK,2018,1,2,"Whole Grains Every Day, Every Way",,Lorna Sass,"Cooking & Food, Nonfiction","Random House, Inc.",2013
4579,Digital,OverDrive,AUDIOBOOK,2018,1,1,"The Riven Kingdom: Godspeaker Trilogy, Book 2 (unabridged) (Unabridged)",,Karen Miller,"Fantasy, Fiction","Tantor Media, Inc",2013
4624,Digital,OverDrive,EBOOK,2018,1,2,"Whisper to the Blood: Kate Shugak Series, Book 16",,Dana Stabenow,"Fiction, Mystery",Macmillan Publishers,2013
4626,Digital,OverDrive,EBOOK,2018,1,1,The Art of Being Brilliant: Transform Your Life by Doing What Works For You,,Andy Cope,"Business, Nonfiction","John Wiley & Sons, Inc.",2013
4648,Digital,OverDrive,AUDIOBOOK,2018,1,6,"Titan: The Life of John D. Rockefeller, Sr. (unabridged) (Unabridged)",,Ron Chernow,"Biography & Autobiography, Business, History, Nonfiction","Blackstone Audio, Inc.",2013
4654,Digital,OverDrive,EBOOK,2018,1,1,"Six Geese A-Slaying: Meg Langslow Mystery Series, Book 10",,Donna Andrews,"Fiction, Humor (Fiction), Mystery",Macmillan Publishers,2013
4665,Digital,OverDrive,EBOOK,2018,1,1,Islands of Destiny: The Solomons Campaign and the Eclipse of the Rising Sun,,John Prados,"History, Military, Nonfiction","Penguin Group (USA), Inc.",2013
4689,Digital,OverDrive,EBOOK,2018,1,3,"Ask the Cards a Question: Sharon McCone Mystery Series, Book 2",,Marcia Muller,"Fiction, Mystery","Blackstone Audio, Inc.",2013
4701,Digital,OverDrive,EBOOK,2018,1,1,The Morels,,Christopher Hacker,"Fiction, Literature","Random House, Inc.",2013
4720,Digital,OverDrive,AUDIOBOOK,2018,1,1,The Tale of Peter Rabbit (Unabridged),,Beatrix Potter,"Classic Literature, Fantasy, Juvenile Fiction",Interactive Media,2013
4728,Digital,OverDrive,EBOOK,2018,1,1,"Compelling Evidence: Paul Madriani Series, Book 1",,Steve Martini,"Fiction, Thriller","Penguin Group (USA), Inc.",2013
4731,Digital,OverDrive,EBOOK,2018,1,1,Cagney,,John McCabe,"Biography & Autobiography, Nonfiction, Performing Arts","Random House, Inc.",2013
4736,Digital,OverDrive,EBOOK,2018,1,1,"The Highwayman: Saga of the First King, Book 1",,R. A. Salvatore,"Fantasy, Fiction",Macmillan Publishers,2013
4803,Digital,OverDrive,EBOOK,2018,1,1,"Christmas with Holly: Friday Harbor Series, Book 1",,Lisa Kleypas,"Fiction, Romance",Macmillan Publishers,2013
4813,Digital,OverDrive,AUDIOBOOK,2018,1,1,Fun Is Good: How to Create Joy & Passion in your Workplace & Career (unabridged) (Unabridged),,Mike Veeck,"Business, Management, Nonfiction, Self-Improvement",Gildan Media Corp,2013
4821,Digital,OverDrive,EBOOK,2018,1,4,Daughter of the God-King,,Anne Cleeland,"Fiction, Historical Fiction",Sourcebooks,2013
4879,Digital,OverDrive,EBOOK,2018,1,5,"Girl, Interrupted",,Susanna Kaysen,"Biography & Autobiography, Nonfiction, Psychology, Sociology","Random House, Inc.",2013
4880,Digital,OverDrive,EBOOK,2018,1,1,"A Grave Denied: Kate Shugak Series, Book 13",,Dana Stabenow,"Fiction, Mystery",Macmillan Publishers,2013
4969,Digital,OverDrive,EBOOK,2018,1,2,"Wild Card: Elite Ops Series, Book 1",,Lora Leigh,"Fiction, Romance, Suspense",Macmillan Publishers,2013
4995,Digital,OverDrive,EBOOK,2018,1,2,"The Thunder Keeper: Father John and Vicky Holden Series, Book 7",,Margaret Coel,"Fiction, Mystery","Penguin Group (USA), Inc.",2013
5007,Digital,OverDrive,EBOOK,2018,1,1,"Quinn: Eve Duncan Series, Book 13",,Iris Johansen,"Fiction, Thriller",Macmillan Publishers,2013
5019,Digital,OverDrive,EBOOK,2018,1,1,Ten Rules for Living with My Sister,,Ann M. Martin,Juvenile Fiction,Macmillan Publishers,2013
5035,Digital,OverDrive,EBOOK,2018,1,4,Odd Girl Out,,Ann Bannon,"Fiction, Literature, Romance","Simon & Schuster, Inc.",2013
5047,Digital,OverDrive,EBOOK,2018,1,1,"Skylark: Sarah, Plain and Tall Series, Book 2",,Patricia MacLachlan,"Historical Fiction, Juvenile Fiction",HarperCollins Publishers Inc.,2013
5051,Digital,OverDrive,EBOOK,2018,1,5,"Rose Harbor in Bloom: Rose Harbor Series, Book 2",,Debbie Macomber,"Fiction, Romance","Random House, Inc.",2013
5094,Digital,OverDrive,EBOOK,2018,1,1,In the Spirit of Happiness,,Monks of New Skete,"Nonfiction, Religion & Spirituality","Hachette Digital, Inc.",2013
5122,Digital,OverDrive,EBOOK,2018,1,2,Selected Stories,,O. Henry,"Fiction, Short Stories","Penguin Group (USA), Inc.",2013
5126,Digital,OverDrive,EBOOK,2018,1,3,Whip Smart: A Memoir,,Melissa Febos,"Biography & Autobiography, Nonfiction",Macmillan Publishers,2013
5138,Digital,OverDrive,EBOOK,2018,1,1,"My First New York: Early Adventures in the Big City (As Remembered by Actors, Artists, Athletes, Chefs, Comedians, Filmmakers, Mayors, Models, Moguls, Porn Stars, Rockers, Writers, and Others)",,New York Magazine,"Nonfiction, Travel",HarperCollins Publishers Inc.,2013
5157,Digital,OverDrive,EBOOK,2018,1,2,"Guilt by Degrees: Rachel Knight Series, Book 2",,Marcia Clark,"Fiction, Thriller","Hachette Digital, Inc.",2013
5207,Digital,OverDrive,AUDIOBOOK,2018,1,2,The Golden Notebook (Unabridged),,Doris Lessing,"Fiction, Literature","Naxos of America, Inc.",2013
5229,Digital,OverDrive,AUDIOBOOK,2018,1,2,"Release Me: Stark Trilogy, Book 1 (unabridged) (Unabridged)",,J. Kenner,"Erotic Literature, Fiction, Romance",Books on Tape,2013
5247,Digital,OverDrive,AUDIOBOOK,2018,1,1,Escape (Unabridged),,James Clavell,"Fiction, Literature",Books on Tape,2013
5355,Digital,OverDrive,EBOOK,2018,1,1,"L.A. Confidential: L. A. Quartet, Book 3",,James Ellroy,"Fiction, Historical Fiction, Mystery","Hachette Digital, Inc.",2013
5387,Digital,OverDrive,EBOOK,2018,1,19,The Snow Child: A Novel,,Eowyn Ivey,"Fiction, Historical Fiction, Literature","Hachette Digital, Inc.",2013
5389,Digital,OverDrive,EBOOK,2018,1,1,Girl Factory: A Memoir,,Karen Dietrich,"Biography & Autobiography, Nonfiction",Rowman and Littlefield Publishing Group,2013
5443,Digital,OverDrive,AUDIOBOOK,2018,1,1,The Liberator: One World War II Soldier's 500-Day Odyssey from the Beaches of Sicily to the Gates of Dachau (unabridged) (Unabridged),,Alex Kershaw,"History, Military, Nonfiction",Books on Tape,2013
5469,Digital,OverDrive,EBOOK,2018,1,2,"Eternal Rider: Lords of Deliverance Series, Book 1",,Larissa Ione,"Fantasy, Fiction, Romance","Hachette Digital, Inc.",2013
5491,Digital,OverDrive,EBOOK,2018,1,2,Unnatural Creatures: Stories Selected by Neil Gaiman,,Neil Gaiman,"Short Stories, Young Adult Fiction",HarperCollins Publishers Inc.,2013
5501,Digital,OverDrive,EBOOK,2018,1,5,"Twice Tempted: Night Prince Series, Book 2",,Jeaniene Frost,"Fantasy, Fiction, Romance",HarperCollins Publishers Inc.,2013
5511,Digital,OverDrive,EBOOK,2018,1,1,Pacific Salmon,,Jason Cooper,"Juvenile Nonfiction, Nature, Science",Britannica Digital Learning,2013
5554,Digital,OverDrive,EBOOK,2018,1,2,"Blindsight: Jack Stapleton / Laurie Montgomery Series, Book 1",,Robin Cook,"Fiction, Thriller","Penguin Group (USA), Inc.",2013
5570,Digital,OverDrive,EBOOK,2018,1,5,Wild Invitation: A Psy-Changeling Collection,,Nalini Singh,"Fantasy, Fiction, Romance","Penguin Group (USA), Inc.",2013
5571,Digital,OverDrive,EBOOK,2018,1,1,Sophomore: Undeclared,,Daisy Harris,"Erotic Literature, Fiction, Romance",Totally Bound Publishing,2013
5580,Digital,OverDrive,EBOOK,2018,1,1,"Sweet as Sugar, Hot as Spice: Farrel Sisters Series, Book 3",,Kimberly Raye,"Fiction, Romance","Hachette Digital, Inc.",2013
5612,Digital,OverDrive,AUDIOBOOK,2018,1,1,Joe Ledger: The Missing Files (unabridged) (Unabridged),,Jonathan Maberry,"Fiction, Horror, Thriller","Blackstone Audio, Inc.",2013
5619,Digital,OverDrive,AUDIOBOOK,2018,1,3,The Leopard (Unabridged),,Giuseppe Tomasi di Lampedusa,"Classic Literature, Fiction","Naxos of America, Inc.",2013
5623,Digital,OverDrive,AUDIOBOOK,2018,1,4,"Horde: Razorland Series, Book 3 (unabridged) (Unabridged)",,Ann Aguirre,"Fantasy, Science Fiction & Fantasy, Young Adult Fiction, Young Adult Literature",Macmillan Audio,2013
5627,Digital,OverDrive,AUDIOBOOK,2018,1,1,"Two Brides Too Many: The Sinclair Sisters of Cripple Creek Series, Book 1 (unabridged) (Unabridged)",,Mona Hodgson,"Christian Fiction, Fiction, Historical Fiction, Romance",Books on Tape,2013
5628,Digital,OverDrive,EBOOK,2018,1,23,Tenth of December: Stories,,George Saunders,"Fiction, Literature, Short Stories","Random House, Inc.",2013
5773,Digital,OverDrive,EBOOK,2018,1,1,"Summerkin: Winterling Series, Book 2",,Sarah Prineas,"Fantasy, Juvenile Fiction",HarperCollins Publishers Inc.,2013
5795,Digital,OverDrive,EBOOK,2018,1,1,Reckoning,,David Halberstam,"Business, Nonfiction",Open Road Integrated Media,2013
5823,Digital,OverDrive,EBOOK,2018,1,5,"Captivated: Donovan Legacy Series, Book 1",,Nora Roberts,"Fiction, Romance","Penguin Group (USA), Inc.",2013
5844,Digital,OverDrive,EBOOK,2018,1,1,"Waking Up with a Rake: Regency Rakes Series, Book 1",,Connie Mason,"Fiction, Historical Fiction, Romance",Sourcebooks,2013
5847,Digital,OverDrive,EBOOK,2018,1,6,"Immortal in Death: In Death Series, Book 3",,J. D. Robb,"Fiction, Romance, Suspense","Penguin Group (USA), Inc.",2013
5851,Digital,OverDrive,EBOOK,2018,1,1,Splendor,,Elana K. Arnold,"Romance, Young Adult Fiction, Young Adult Literature","Random House, Inc.",2013
5864,Digital,OverDrive,AUDIOBOOK,2018,1,1,"Cave of Wonders: Infinity Ring Series, Book 5 (unabridged) (Unabridged)",,Matt Kirby,"Historical Fiction, Juvenile Fiction, Science Fiction",Scholastic Inc. Audiobooks,2013
5949,Digital,OverDrive,EBOOK,2018,1,3,"Seeing Red: Firefighters Series, Book 3",,Jill Shalvis,"Fiction, Romance, Suspense","Hachette Digital, Inc.",2013
5969,Digital,OverDrive,EBOOK,2018,1,3,"In Like Flynn: Molly Murphy Series, Book 4",,Rhys Bowen,"Fiction, Historical Fiction, Mystery",Macmillan Publishers,2013
6041,Digital,OverDrive,EBOOK,2018,1,9,Shantaram: A Novel,,Gregory David Roberts,"Fiction, Thriller",Macmillan Publishers,2013
6075,Digital,OverDrive,EBOOK,2018,1,1,"Born to Be Wild: The Others Series, Book 15",,Christine Warren,"Fantasy, Fiction, Romance",Macmillan Publishers,2013
6227,Digital,OverDrive,EBOOK,2018,1,3,The Psychology of Love,,Sigmund Freud,"Nonfiction, Psychology","Penguin Group (USA), Inc.",2013
6235,Digital,OverDrive,AUDIOBOOK,2018,1,1,Don't Go (Unabridged),,Lisa Scottoline,"Fiction, Suspense, Thriller",Macmillan Audio,2013
6239,Digital,OverDrive,EBOOK,2018,1,1,"Shadow of the Hegemon: Ender Wiggin: Shadow Saga, Book 2",,Orson Scott Card,"Fiction, Science Fiction",Macmillan Publishers,2013
6257,Digital,OverDrive,EBOOK,2018,1,1,Above Suspicion,,Helen Macinnes,"Fiction, Suspense, Thriller","Random House, Inc.",2013
6262,Digital,OverDrive,EBOOK,2018,1,1,Smashing Logo Design: The Art of Creating Visual Identities,,Gareth Hardy,"Computer Technology, Nonfiction","John Wiley & Sons, Inc.",2013
6294,Digital,OverDrive,EBOOK,2018,1,4,"Seven Up: Stephanie Plum Series, Book 7",,Janet Evanovich,"Fiction, Humor (Fiction), Mystery",Macmillan Publishers,2013
6334,Digital,OverDrive,EBOOK,2018,1,2,"Taking Chase: Chase Brothers Series, Book 2",,Lauren Dane,"Erotic Literature, Fiction, Romance","Samhain Publishing, Ltd.",2013
6362,Digital,OverDrive,EBOOK,2018,1,1,An Indecent Proposition,,Emma Wildes,"Fiction, Romance","Penguin Group (USA), Inc.",2013
6442,Digital,OverDrive,AUDIOBOOK,2018,1,1,Cleaning House: A Mom's Twelve-Month Experiment to Rid Her Home of Youth Entitlement (unabridged) (Unabridged),,Kay Wills Wyma,"Nonfiction, Religion & Spirituality","Christian Audio, LLC",2013
6530,Digital,OverDrive,EBOOK,2018,1,1,"Betrayal: Scarlet Deception, Book 3",,Christina Dodd,"Fiction, Romance, Suspense","Penguin Group (USA), Inc.",2013
6560,Digital,OverDrive,EBOOK,2018,1,3,Headhunters on My Doorstep: A True Treasure Island Ghost Story,,J. Maarten Troost,"Biography & Autobiography, Nonfiction","Penguin Group (USA), Inc.",2013
6570,Digital,OverDrive,AUDIOBOOK,2018,1,7,We Are All Completely Beside Ourselves: A Novel (unabridged) (Unabridged),,Karen Joy Fowler,"Fiction, Literature","Blackstone Audio, Inc.",2013
6619,Digital,OverDrive,EBOOK,2018,1,2,Once More With Feeling,,Nora Roberts,"Fiction, Humor (Fiction), Romance","Penguin Group (USA), Inc.",2013
6631,Digital,OverDrive,AUDIOBOOK,2018,1,1,Hope and Help for Your Nerves (Unabridged),,Dr. Claire Weekes,"Nonfiction, Self-Improvement",HighBridge Company,2013
6650,Digital,OverDrive,AUDIOBOOK,2018,1,1,"The Perfect Match: Blue Heron Series, Book 2 (unabridged) (Unabridged)",,Kristan Higgins,"Fiction, Romance","Blackstone Audio, Inc.",2013
6654,Digital,OverDrive,EBOOK,2018,1,1,The Spymaster's Daughter,,Jeane Westin,"Fiction, Historical Fiction","Penguin Group (USA), Inc.",2013
6661,Digital,OverDrive,AUDIOBOOK,2018,1,3,The Spirit of Kaizen: Creating Lasting Excellence One Small Step at a Time (unabridged) (Unabridged),,Bob Maurer,"Business, Nonfiction",Books on Tape,2013
6663,Digital,OverDrive,EBOOK,2018,1,2,"Come a Little Bit Closer: The Sullivans Series, Book 7",,Bella Andre,"Fiction, Romance",Oak Press LLC,2013
6667,Digital,OverDrive,EBOOK,2018,1,1,Amsterdam: A History of the World's Most Liberal City,,Russell Shorto,"History, Nonfiction, Travel","Random House, Inc.",2013
6683,Digital,OverDrive,EBOOK,2018,1,2,"Who Was Martin Luther King, Jr.?",,Bonnie Bader,"Biography & Autobiography, Juvenile Nonfiction","Penguin Group (USA), Inc.",2013
6700,Digital,OverDrive,EBOOK,2018,1,1,Like Pickle Juice on a Cookie,,Julie Sternberg,"Juvenile Fiction, Literature",ABRAMS,2013
6725,Digital,OverDrive,EBOOK,2018,1,1,Dogs of War,,Frederick Forsyth,"Fiction, Thriller","Penguin Group (USA), Inc.",2013
6729,Digital,OverDrive,EBOOK,2018,1,1,Buying Trouble: A Companion Novella to Midnight's Daughter,,Karen Chance,"Fantasy, Fiction, Romance, Thriller","Penguin Group (USA), Inc.",2013
6821,Digital,OverDrive,EBOOK,2018,1,1,"The Lost Tomb: Jack Howard Series, Book 3",,David Gibbins,"Fiction, Historical Fiction, Suspense, Thriller","Random House, Inc.",2013
6840,Digital,OverDrive,AUDIOBOOK,2018,1,2,Shade's Children (Unabridged),,Garth Nix,"Science Fiction & Fantasy, Suspense, Young Adult Fiction","Blackstone Audio, Inc.",2013
6868,Digital,OverDrive,EBOOK,2018,1,3,The Light in the Ruins,,Chris Bohjalian,"Fiction, Historical Fiction, Literature, Mystery","Random House, Inc.",2013
6878,Digital,OverDrive,EBOOK,2018,1,1,Wickedly Ever After,,Michelle Marcos,"Fiction, Historical Fiction, Romance",Macmillan Publishers,2013
6951,Digital,OverDrive,EBOOK,2018,1,1,Audrey in Rome,,Luca Dotti,"Biography & Autobiography, Nonfiction, Performing Arts, Photography",HarperCollins Publishers Inc.,2013
6952,Physical,Horizon,BOOK,2018,1,1,Hand quilted with love : patchwork projects inspired by a passion for quilting / Sarah Fielke.,,"Fielke, Sarah","Quilting, Quilting Patterns","CICO Books,",2013
6960,Digital,OverDrive,EBOOK,2018,1,1,O Come All Ye Kinky,,Sarah Frantz,"Erotic Literature, Fiction, Romance",Riptide Publishing,2013
6962,Digital,OverDrive,AUDIOBOOK,2018,1,1,Splat the Cat with a Bang and a Clang: I Can Read Level 1 (unabridged) (Unabridged),,Rob Scotton,"Beginning Reader, Humor (Fiction), Juvenile Fiction",HarperCollins Publishers Inc.,2013
6979,Digital,OverDrive,AUDIOBOOK,2018,1,3,"My Brother Is a Big, Fat Liar: Middle School Series, Book 3 (unabridged) (Unabridged)",,James Patterson,"Humor (Fiction), Juvenile Fiction","Blackstone Audio, Inc.",2013
6995,Digital,OverDrive,AUDIOBOOK,2018,1,1,Suite Francaise (Unabridged),,Irene Nemirovsky,"Fiction, Literature",Books on Tape,2013
6998,Digital,OverDrive,AUDIOBOOK,2018,1,5,The Interestings: A Novel (unabridged) (Unabridged),,Meg Wolitzer,"Fiction, Literature","Dreamscape Media, LLC",2013
7005,Digital,OverDrive,EBOOK,2018,1,1,Three Heroes,,Jo Beverley,"Fiction, Historical Fiction, Romance","Penguin Group (USA), Inc.",2013
7013,Digital,OverDrive,EBOOK,2018,1,2,"Perilous Shield: The Lost Fleet: The Lost Stars Series, Book 2",,Jack Campbell,"Fiction, Science Fiction","Penguin Group (USA), Inc.",2013
7031,Digital,OverDrive,EBOOK,2018,1,1,"People of the Silence: First North American Series, Book 8",,Kathleen O'Neal Gear,"Fiction, Historical Fiction",Macmillan Publishers,2013
7050,Digital,OverDrive,AUDIOBOOK,2018,1,1,Unfinished Business: What the Dead Can Teach Us About Life (unabridged) (Unabridged),,James Van Praagh,"New Age, Nonfiction",HarperCollins Publishers Inc.,2013
7073,Digital,OverDrive,EBOOK,2018,1,1,"Angry Lead Skies: Garrett, P.I. Series, Book 10",,Glen Cook,"Fantasy, Fiction","Penguin Group (USA), Inc.",2013
7109,Digital,OverDrive,EBOOK,2018,1,2,"Furniture Makeovers: Simple Techniques for Transforming Furniture with Paint, Stains, Paper, Stencils, and More",,Barb Blair,"Home Design & Décor, Nonfiction",Chronicle Books,2013
7158,Digital,OverDrive,EBOOK,2018,1,4,James and the Giant Peach,,Roald Dahl,"Classic Literature, Fantasy, Juvenile Fiction","Penguin Group (USA), Inc.",2013
7178,Digital,OverDrive,EBOOK,2018,1,3,"Hush Money: Spenser Series, Book 26",,Robert B. Parker,"Fiction, Mystery","Penguin Group (USA), Inc.",2013
7217,Digital,OverDrive,EBOOK,2018,1,8,"Dawn: Xenogenesis Trilogy, Book 1",,Octavia E. Butler,"Fiction, Science Fiction",Open Road Integrated Media,2013
7245,Digital,OverDrive,EBOOK,2018,1,1,"The Gold Falcon: Deverry: The Silver Wyrm Series, Book 1",,Katharine Kerr,"Fantasy, Fiction","Penguin Group (USA), Inc.",2013
7294,Digital,OverDrive,AUDIOBOOK,2018,1,2,Blood & Beauty (Unabridged),,Sarah Dunant,"Fiction, Historical Fiction",Books on Tape,2013
7300,Digital,OverDrive,AUDIOBOOK,2018,1,9,"One Summer: America, 1927 (unabridged) (Unabridged)",,Bill Bryson,"History, Nonfiction, Sociology",Books on Tape,2013
7365,Digital,OverDrive,EBOOK,2018,1,1,Lickin' License: From Lust to Love to Deception and Death,,Intelligent Allah,"African American Fiction, Erotic Literature, Fiction, Urban Fiction","wahida clark presents publishing, llc",2013
7376,Digital,OverDrive,EBOOK,2018,1,1,"Shattered Souls: Shattered Souls Series, Book 1",,Mary Lindsey,"Historical Fiction, Horror, Romance, Young Adult Fiction","Penguin Group (USA), Inc.",2013
7379,Digital,OverDrive,EBOOK,2018,1,2,It's All American Food: The Best Recipes for More than 400 New American Classics,,David Rosengarten,"Cooking & Food, Nonfiction","Hachette Digital, Inc.",2013
7383,Digital,OverDrive,EBOOK,2018,1,1,"Seventh Son: Tales of Alvin Maker, Book 1",,Orson Scott Card,"Fantasy, Fiction",Macmillan Publishers,2013
7389,Digital,OverDrive,EBOOK,2018,1,1,心理学经典实验书系：儿童心理学 (Child psychology),,Bian YuFang,"Education, Nonfiction","Zhejiang Publishing United Group Digital Media Co.,Ltd",2013
7397,Digital,OverDrive,EBOOK,2018,1,1,Here There Be Monsters,,Meljean Brook,"Fantasy, Fiction, Romance","Penguin Group (USA), Inc.",2013
7410,Digital,OverDrive,EBOOK,2018,1,1,"Piper Reed, Clubhouse Queen: Piper Reed Series, Book 2",,Kimberly Willis Holt,"Juvenile Fiction, Juvenile Literature",Macmillan Publishers,2013
7433,Digital,OverDrive,EBOOK,2018,1,2,Naughty Bedtime Stories,,Joan Elizabeth Lloyd,Fiction,"Penguin Group (USA), Inc.",2013
7482,Digital,OverDrive,EBOOK,2018,1,1,"The Deadly Race to Space: Russia: Secret Agent Jack Stalwart Series, Book 9",,Elizabeth Singer Hunt,"Juvenile Fiction, Juvenile Literature","Hachette Digital, Inc.",2013
7510,Digital,OverDrive,EBOOK,2018,1,1,"The Year's Best Science Fiction, Twelfth Annual Collection",,Gardner Dozois,"Fiction, Science Fiction, Short Stories",Macmillan Publishers,2013
7539,Digital,OverDrive,EBOOK,2018,1,20,"Raven Black: Shetland Island Mystery Series, Book 1",,Ann Cleeves,"Fiction, Mystery",Macmillan Publishers,2013
7553,Digital,OverDrive,EBOOK,2018,1,1,The Tragedy of Mister Morn,,Vladimir Nabokov,"Drama, Fiction, Literature","Random House, Inc.",2013
7554,Digital,OverDrive,EBOOK,2018,1,3,"Light in Shadow: Whispering Springs Series, Book 1",,Jayne Ann Krentz,"Fiction, Romance, Suspense","Penguin Group (USA), Inc.",2013
