,usageclass,checkouttype,materialtype,checkoutyear,checkoutmonth,checkouts,title,isbn,creator,subjects,publisher,publicationyear
7587,Digital,OverDrive,AUDIOBOOK,2018,1,1,Huff and Puff Sing Along: My First I Can Read (unabridged) (Unabridged),,Tish Rabe,"Beginning Reader, Juvenile Fiction",HarperCollins Publishers Inc.,2013
7591,Digital,OverDrive,EBOOK,2018,1,1,Heretics and Heroes: How Renaissance Artists and Reformation Priests Created Our World,,Thomas Cahill,"Art, History, Nonfiction","Random House, Inc.",2013
7592,Digital,OverDrive,EBOOK,2018,1,1,The Quantum Doctor: A Quantum Physicist Explains the Healing Power of Integral Medicine,,Amit Goswami,"New Age, Nonfiction",Red Wheel Weiser Conari,2013
7632,Digital,OverDrive,EBOOK,2018,1,2,"Trouble in Texas: Deep in the Heart of Texas Series, Book 4",,Katie Lane,"Fiction, Romance, Western","Hachette Digital, Inc.",2013
7636,Digital,OverDrive,EBOOK,2018,1,1,"The Girl's Guide to (Man) Hunting: Bluebonnet Series, Book 1",,Jessica Clare,"Fiction, Romance","Penguin Group (USA), Inc.",2013
7646,Digital,OverDrive,EBOOK,2018,1,2,"The Vicious Vet: Agatha Raisin Mystery Series, Book 2",,M. C. Beaton,"Fiction, Humor (Fiction), Mystery",Macmillan Publishers,2013
7722,Digital,OverDrive,AUDIOBOOK,2018,1,2,The Piano Tuner: A Novel (unabridged) (Unabridged),,Daniel Mason,"Fiction, Literature",Books on Tape,2013
7726,Digital,OverDrive,EBOOK,2018,1,1,"Unsympathetic Magic: Esther Diamond Series, Book 3",,Laura Resnick,"Fantasy, Fiction","Penguin Group (USA), Inc.",2013
7735,Digital,OverDrive,EBOOK,2018,1,1,Bring the Outdoors In: 20 Garden Projects for the Decorating and Styling Interiors,,Shane Powers,"Home Design & Décor, Nonfiction",Chronicle Books,2013
7769,Digital,OverDrive,AUDIOBOOK,2018,1,1,"The Beautiful and the Cursed: The Dispossessed Series, Book 1 (unabridged) (Unabridged)",,Page Morgan,"Fantasy, Mystery, Suspense, Young Adult Fiction",Books on Tape,2013
7807,Digital,OverDrive,EBOOK,2018,1,1,The Secret of Happy Ever After,,Lucy Dillon,"Fiction, Literature","Penguin Group (USA), Inc.",2013
7828,Digital,OverDrive,EBOOK,2018,1,1,"The Slow Fix: Solve Problems, Work Smarter, and Live Better In a World Addicted to Speed",,Carl Honore,"Business, Nonfiction, Self-Improvement, Sociology",HarperCollins Publishers Inc.,2013
7840,Digital,OverDrive,AUDIOBOOK,2018,1,1,Life's a Witch (Unabridged),,Brittany Geragotelis,"Juvenile Fiction, Juvenile Literature, Young Adult Literature",Simon & Schuster - All Library,2013
7849,Digital,OverDrive,EBOOK,2018,1,3,"The Empress File: Kidd and LuEllen Series, Book 2",,John Sandford,"Fiction, Thriller","Penguin Group (USA), Inc.",2013
7859,Digital,OverDrive,EBOOK,2018,1,1,"The Devil's Domain: Sorrowful Mysteries of Brother Athelstan Series, Book 8",,Paul Doherty,"Fiction, Historical Fiction, Mystery",Severn House Publishers Ltd,2013
7862,Digital,OverDrive,EBOOK,2018,1,2,"A Dangerous Love: Border Chronicles, Book 1",,Bertrice Small,"Fiction, Romance","Penguin Group (USA), Inc.",2013
7912,Digital,OverDrive,EBOOK,2018,1,4,"Magic Lost, Trouble Found: Raine Benares Series, Book 1",,Lisa Shearin,"Fantasy, Fiction","Penguin Group (USA), Inc.",2013
7940,Digital,OverDrive,EBOOK,2018,1,1,One Big Thing: Discovering What You Were Born to Do,,Phil Howard Cooke,"Business, Nonfiction",Thomas Nelson Inc.,2013
7948,Digital,OverDrive,EBOOK,2018,1,2,"In Bed with the Duke: The Governess Brides Series, Book 8",,Christina Dodd,"Fiction, Historical Fiction, Romance","Penguin Group (USA), Inc.",2013
7963,Digital,OverDrive,EBOOK,2018,1,3,Double Sin and Other Stories,,Agatha Christie,"Fiction, Mystery",HarperCollins Publishers Inc.,2013
7988,Digital,OverDrive,EBOOK,2018,1,3,The Ladies of Grace Adieu and Other Stories,,Susanna Clarke,"Fiction, Literature",Bloomsbury USA,2013
7996,Digital,OverDrive,EBOOK,2018,1,1,"Tell Me, Pretty Maiden: Molly Murphy Series, Book 7",,Rhys Bowen,"Fiction, Historical Fiction, Mystery",Macmillan Publishers,2013
8048,Digital,OverDrive,EBOOK,2018,1,1,Conjured,,Sarah Beth Durst,"Mystery, Young Adult Fiction",Bloomsbury USA,2013
8053,Digital,OverDrive,AUDIOBOOK,2018,1,6,"Murder on the Flying Scotsman: Daisy Dalrymple Series, Book 4 (unabridged) (Unabridged)",,Carola Dunn,"Fiction, Mystery","Blackstone Audio, Inc.",2013
8054,Digital,OverDrive,AUDIOBOOK,2018,1,2,"A World Without Heroes: Beyonders Series, Book 1 (unabridged) (Unabridged)",,Brandon Mull,"Fantasy, Young Adult Fiction",Simon & Schuster - All Library,2013
8075,Digital,OverDrive,EBOOK,2018,1,3,Mind's Own Physician: A Scientific Dialogue with the Dalai Lama on the Healing Power of Meditation,,Jon Kabat-Zinn,"Health & Fitness, Nonfiction",New Harbinger Publications,2013
8102,Digital,OverDrive,EBOOK,2018,1,2,On the Island: A Novel,,Tracey Garvis Graves,"Fiction, Romance","Penguin Group (USA), Inc.",2013
8136,Digital,OverDrive,EBOOK,2018,1,1,"Grandad, There's a Head on the Beach: Jimm Juree Series, Book 2",,Colin Cotterill,"Fiction, Mystery",Macmillan Publishers,2013
8149,Digital,OverDrive,EBOOK,2018,1,1,"The Mark of the Vampire Queen: Vampire Queen Series, Book 2",,Joey W. Hill,"Erotic Literature, Fantasy, Fiction, Romance","Penguin Group (USA), Inc.",2013
8202,Digital,OverDrive,EBOOK,2018,1,2,Annals of the Former World,,John McPhee,"Nonfiction, Science",Macmillan Publishers,2013
8208,Digital,OverDrive,EBOOK,2018,1,1,Winter's Tide,,Lisa Williams Kline,Juvenile Fiction,Zondervan,2013
8210,Digital,OverDrive,EBOOK,2018,1,1,"The Pericles Commission: Athenian Mystery Series, Book 1",,Gary Corby,"Fiction, Historical Fiction, Mystery",Macmillan Publishers,2013
8213,Digital,OverDrive,EBOOK,2018,1,3,"The Winning Hand: MacGregor Series, Book 9",,Nora Roberts,"Fiction, Romance","Penguin Group (USA), Inc.",2013
8221,Digital,OverDrive,AUDIOBOOK,2018,1,1,"Reinventing You: Define Your Brand, Imagine Your Future (unabridged) (Unabridged)",,Dorie Clark,"Business, Nonfiction",Gildan Media Corp,2013
8272,Digital,OverDrive,EBOOK,2018,1,5,"Death of a Hussy: Hamish Macbeth Mystery Series, Book 5",,M. C. Beaton,"Fiction, Mystery","Hachette Digital, Inc.",2013
8301,Digital,OverDrive,EBOOK,2018,1,1,The Garden District of New Orleans,,Jim Fraiser,"History, Nonfiction",University Press of Mississippi,2013
8302,Digital,OverDrive,EBOOK,2018,1,1,Night Light,,Terri Blackstock,"Fiction, Science Fiction, Suspense, Thriller",Zondervan,2013
8321,Digital,OverDrive,EBOOK,2018,1,2,"I Married the Duke: Prince Catchers Series, Book 1",,Katharine Ashe,"Fiction, Historical Fiction, Romance",HarperCollins Publishers Inc.,2013
8358,Digital,OverDrive,EBOOK,2018,1,1,"Moon Burning: Children of the Moon Series, Book 3",,Lucy Monroe,"Fantasy, Fiction, Romance","Penguin Group (USA), Inc.",2013
8411,Digital,OverDrive,EBOOK,2018,1,1,Myself and I,,Earl Sewell,"African American Fiction, Young Adult Fiction","Harlequin Enterprises, Ltd.",2013
8438,Digital,OverDrive,EBOOK,2018,1,2,Fairy Dreams (Barbie),,Mary Man-Kong,"Beginning Reader, Juvenile Fiction, Juvenile Literature","Random House, Inc.",2013
8475,Digital,OverDrive,EBOOK,2018,1,1,Mistress of Mellyn,,Victoria Holt,"Fiction, Romance",Macmillan Publishers,2013
8479,Digital,OverDrive,EBOOK,2018,1,2,"Renegade: Elite Ops Series, Book 5",,Lora Leigh,"Fiction, Romance, Suspense",Macmillan Publishers,2013
8522,Digital,OverDrive,EBOOK,2018,1,2,Lucky Penny,,Catherine Anderson,"Fiction, Romance","Penguin Group (USA), Inc.",2013
8553,Digital,OverDrive,EBOOK,2018,1,4,"Only Time Will Tell: Clifton Chronicles, Book 1",,Jeffrey Archer,"Fiction, Historical Fiction",Macmillan Publishers,2013
8557,Digital,OverDrive,EBOOK,2018,1,1,The Color Master: Stories,,Aimee Bender,"Fiction, Literature, Short Stories","Random House, Inc.",2013
8562,Digital,OverDrive,EBOOK,2018,1,1,Lifetime,,Christopher Silas Neal,"Juvenile Nonfiction, Nature",Chronicle Books,2013
8564,Digital,OverDrive,EBOOK,2018,1,1,"Shadow Puppets: Ender Wiggin: Shadow Saga, Book 3",,Orson Scott Card,"Fiction, Science Fiction",Macmillan Publishers,2013
8620,Digital,OverDrive,EBOOK,2018,1,8,"Glory in Death: In Death Series, Book 2",,J. D. Robb,"Fiction, Romance, Suspense","Penguin Group (USA), Inc.",2013
8623,Digital,OverDrive,EBOOK,2018,1,2,Steal Across the Sky,,Nancy Kress,"Fiction, Science Fiction",Macmillan Publishers,2013
8640,Digital,OverDrive,EBOOK,2018,1,1,The Married Kama Sutra: The World's Least Erotic Sex Manual,,Simon Rich,"Family & Relationships, Humor (Nonfiction), Nonfiction","Hachette Digital, Inc.",2013
8646,Digital,OverDrive,EBOOK,2018,1,2,"Fortunately, the Milk",,Neil Gaiman,"Humor (Fiction), Juvenile Fiction",HarperCollins Publishers Inc.,2013
8650,Digital,OverDrive,EBOOK,2018,1,1,Ten Billion,,Stephen Emmott,"Nonfiction, Politics, Science, Sociology","Random House, Inc.",2013
8682,Digital,OverDrive,AUDIOBOOK,2018,1,1,"In Harm's Way: Benjamin Pratt and the Keepers of the School Series, Book 4 (unabridged) (Unabridged)",,Andrew Clements,"Juvenile Fiction, Juvenile Literature",Simon & Schuster - All Library,2013
8710,Digital,OverDrive,EBOOK,2018,1,5,"Deck the Halls, We're Off the Walls!: My Weird School Special Series, Book 3",,Dan Gutman,"Humor (Fiction), Juvenile Fiction",HarperCollins Publishers Inc.,2013
8746,Digital,OverDrive,EBOOK,2018,1,1,Versailles: A Novel,,Kathryn Davis,"Fiction, Historical Fiction",Houghton Mifflin Harcourt Trade and Reference,2013
8767,Digital,OverDrive,EBOOK,2018,1,1,"A Sparrow Falls: The Courtney Family, The First Sequence Series, Book 3",,Wilbur Smith,"Fiction, Historical Fiction, Literature",Macmillan Publishers,2013
8790,Digital,OverDrive,EBOOK,2018,1,2,Time Reborn: From the Crisis in Physics to the Future of the Universe,,Lee Smolin,"Nonfiction, Science",Houghton Mifflin Harcourt Trade and Reference,2013
8801,Digital,OverDrive,EBOOK,2018,1,1,More Than Sorrow: A Mystery,,Vicki Delany,"Fiction, Mystery",Poisoned Pen Press,2013
8802,Digital,OverDrive,EBOOK,2018,1,1,"A World of Curiosities: Surprising, Interesting, and Downright Unbelievable Facts from Every Nation on the Planet",,John Oldale,"Nonfiction, Reference","Penguin Group (USA), Inc.",2013
8829,Digital,OverDrive,EBOOK,2018,1,1,Villette,,Charlotte Bronte,"Classic Literature, Fiction","Penguin Group (USA), Inc.",2013
8840,Digital,OverDrive,EBOOK,2018,1,2,Autobiography of a Corpse,,Sigizmund Krzhizhanovsky,"Fiction, Literature, Short Stories","Random House, Inc.",2013
8894,Digital,OverDrive,EBOOK,2018,1,1,The Magic Finger,,Roald Dahl,"Fantasy, Juvenile Fiction","Penguin Group (USA), Inc.",2013
8904,Digital,OverDrive,EBOOK,2018,1,1,SEAL Team Six: Memoirs of an Elite Navy SEAL Sniper,,Howard E. Wasdin,"Biography & Autobiography, History, Military, Nonfiction",Macmillan Publishers,2013
8961,Digital,OverDrive,AUDIOBOOK,2018,1,1,The Thicket (Unabridged),,Joe R. Lansdale,"Fiction, Mystery, Thriller","Blackstone Audio, Inc.",2013
9062,Digital,OverDrive,AUDIOBOOK,2018,1,4,Assignment in Eternity (Unabridged),,Robert A. Heinlein,"Fiction, Science Fiction","Blackstone Audio, Inc.",2013
9133,Digital,OverDrive,EBOOK,2018,1,3,What to Expect the First Year,,Heidi Murkoff,"Family & Relationships, Nonfiction",Workman Publishing,2013
9138,Digital,OverDrive,EBOOK,2018,1,5,Should We Eat Meat Evolution and Consequences of Modern Carnivory,,Vaclav Smil,"Nonfiction, Technology","John Wiley & Sons, Inc.",2013
9141,Digital,OverDrive,EBOOK,2018,1,1,You Are What You Wear: What Your Clothes Reveal About You,,Jennifer Baumgartner,"Art, Health & Fitness, Nonfiction, Self-Improvement","Hachette Digital, Inc.",2013
9229,Digital,OverDrive,AUDIOBOOK,2018,1,1,"Caps For Sale: The Tale of a Peddler, Some Monkeys and Their Monkey Business (unabridged) (Unabridged)",,Esphyr Slobodkina,"Juvenile Fiction, Juvenile Literature",Live Oak Media,2013
9252,Digital,OverDrive,EBOOK,2018,1,1,Jane Austen,,Carol Shields,"Biography & Autobiography, Nonfiction","Penguin Group (USA), Inc.",2013
9271,Digital,OverDrive,EBOOK,2018,1,1,"Death on a Pale Horse: Lost Sherlock Series, Book 6",,Donald Thomas,"Fiction, Mystery",Open Road Integrated Media,2013
9295,Digital,OverDrive,EBOOK,2018,1,1,"Southern Italian Desserts: Rediscovering the Sweet Traditions of Calabria, Campania, Basilicata, Puglia,and Sicily",,Rosetta Costantino,"Cooking & Food, Nonfiction","Random House, Inc.",2013
9307,Digital,OverDrive,AUDIOBOOK,2018,1,1,"Never Again Good-Bye: Second Chances Series, Book 1 (unabridged) (Unabridged)",,Terri Blackstock,"Christian Fiction, Fiction, Suspense",Zondervan,2013
9322,Digital,OverDrive,EBOOK,2018,1,1,Who Was Ben Franklin?,,Dennis Brindell Fradin,"Biography & Autobiography, Juvenile Nonfiction","Penguin Group (USA), Inc.",2013
9329,Digital,OverDrive,EBOOK,2018,1,3,"Whatever You Do, Don't Run: True Tales of a Botswana Safari Guide",,Peter Allison,"Nonfiction, Travel",Rowman and Littlefield Publishing Group,2013
9349,Digital,OverDrive,EBOOK,2018,1,2,Have Stakes Will Travel: Stories from the World of Jane Yellowrock (An e-Special from New American Library),,Faith Hunter,"Fantasy, Fiction","Penguin Group (USA), Inc.",2013
9361,Digital,OverDrive,EBOOK,2018,1,12,The Checklist Manifesto: How to Get Things Right,,Atul Gawande,"Business, Medical, Nonfiction",Macmillan Publishers,2013
9368,Digital,OverDrive,EBOOK,2018,1,1,"In Danger's Path: The Corps Series, Book 8",,W.E.B. Griffin,"Fiction, Historical Fiction, Thriller","Penguin Group (USA), Inc.",2013
9396,Digital,OverDrive,EBOOK,2018,1,1,The Inventor and the Tycoon: A Gilded Age Murder and the Birth of Moving Pictures,,Edward Ball,"Biography & Autobiography, History, Nonfiction, True Crime","Random House, Inc.",2013
9398,Digital,OverDrive,EBOOK,2018,1,1,Eminent Hipsters,,Donald Fagen,"Biography & Autobiography, Music, Nonfiction, Performing Arts","Penguin Group (USA), Inc.",2013
9412,Digital,OverDrive,EBOOK,2018,1,3,"Organizing from the Inside Out: The Foolproof System For Organizing Your Home, Your Office and Your Life",,Julie Morgenstern,"Home Design & Décor, Nonfiction",Macmillan Publishers,2013
9417,Digital,OverDrive,EBOOK,2018,1,1,"More Beer: Kayankaya Mystery Series, Book 2",,Jakob Arjouni,"Fiction, Mystery","Random House, Inc.",2013
9438,Digital,OverDrive,EBOOK,2018,1,3,"The Naughty Corner: The Naughty Corner Series, Book 1",,Jasmine Haynes,"Erotic Literature, Fiction, Romance","Penguin Group (USA), Inc.",2013
9446,Digital,OverDrive,EBOOK,2018,1,1,"Sweetheart: Archie Sheridan & Gretchen Lowell Series, Book 2",,Chelsea Cain,"Fiction, Mystery, Suspense, Thriller",Macmillan Publishers,2013
9455,Digital,OverDrive,EBOOK,2018,1,4,"Cherished: Delicious Series, Book 1",,Maya Banks,"Erotic Literature, Fiction, Romance","Penguin Group (USA), Inc.",2013
9468,Digital,OverDrive,EBOOK,2018,1,1,Killer Takes All,,Erica  Spindler,"Fiction, Thriller, Thriller","Harlequin Enterprises, Ltd.",2013
9517,Digital,OverDrive,EBOOK,2018,1,1,The Book of Blood: From Legends and Leeches to Vampires and Veins,,HP Newquist,"Nonfiction, Science",Houghton Mifflin Harcourt Trade and Reference,2013
9561,Digital,OverDrive,AUDIOBOOK,2018,1,1,"Capacity for Murder: Professor Bradshaw Mystery Series, Book 3 (unabridged) (Unabridged)",,Bernadette Pajer,"Fiction, Mystery","Blackstone Audio, Inc.",2013
9668,Digital,OverDrive,AUDIOBOOK,2018,1,1,"Black Ice: Young Sherlock Holmes Series, Book 3 (unabridged) (Unabridged)",,Andrew Lane,"Historical Fiction, Mystery, Young Adult Fiction, Young Adult Literature",Macmillan Audio,2013
9669,Digital,OverDrive,EBOOK,2018,1,1,"The Silence: Nell West and Michael Flint Series, Book 3",,Sarah Rayne,"Fiction, Horror",Severn House Publishers Ltd,2013
9675,Digital,OverDrive,EBOOK,2018,1,1,"An Unfinished Life: John F. Kennedy, 1917 - 1963",,Robert Dallek,"Biography & Autobiography, Nonfiction","Hachette Digital, Inc.",2013
9705,Digital,OverDrive,AUDIOBOOK,2018,1,2,"Silentium: Halo: Forerunner Saga, Book 3 (unabridged) (Unabridged)",,Greg Bear,"Fiction, Literature, Science Fiction",Macmillan Audio,2013
9716,Digital,OverDrive,EBOOK,2018,1,1,Mission to Mars: My Vision for Space Exploration,,Buzz Aldrin,"Nonfiction, Science, Technology","Random House, Inc.",2013
9745,Digital,OverDrive,EBOOK,2018,1,1,"The Cat Who Sniffed Glue: The Cat Who Series, Book 8",,Lilian Jackson Braun,"Fiction, Mystery","Penguin Group (USA), Inc.",2013
9750,Digital,OverDrive,EBOOK,2018,1,1,"Betrayal: Dismas Hardy Series, Book 12",,John Lescroart,"Fiction, Thriller","Penguin Group (USA), Inc.",2013
9809,Digital,OverDrive,EBOOK,2018,1,1,"Blood Trust: Jack McClure Series, Book 3",,Eric Van Lustbader,"Fiction, Thriller",Macmillan Publishers,2013
9821,Digital,OverDrive,EBOOK,2018,1,2,"A Beautiful Mess Photo Idea Book: 95 Inspiring Ideas for Photographing Your Friends, Your World, and Yourself",,Elsie Larson,"Crafts, Nonfiction, Photography","Random House, Inc.",2013
9839,Digital,OverDrive,EBOOK,2018,1,1,"Betrayed: The Vampire Journals Series, Book 3",,Morgan Rice,"Fantasy, Romance, Young Adult Fiction",Kobo Writing Life,2013
9861,Digital,OverDrive,EBOOK,2018,1,1,The Empress of Mars,,Kage Baker,"Fiction, Science Fiction",Macmillan Publishers,2013
9885,Digital,OverDrive,EBOOK,2018,1,1,"Cross: Jack Taylor Series, Book 6",,Ken Bruen,"Fiction, Mystery",Macmillan Publishers,2013
9902,Digital,OverDrive,EBOOK,2018,1,1,Who Was Alexander Graham Bell?,,Bonnie Bader,"Biography & Autobiography, Juvenile Nonfiction","Penguin Group (USA), Inc.",2013
9928,Digital,OverDrive,EBOOK,2018,1,3,Unclean Jobs for Women and Girls,,Alissa Nutting,"Fiction, Short Stories",Lightning Source Inc,2013
